### ISSUE TITLE
Crash parsing Redis traffic 

### ISSUE THREAD

**Issue by hiteshmahajan** [elastic/packetbeat#384]
Too many logs getting generated inside /var/log/messages

```
Nov 18 12:51:47 ip-10-168-0-218 /usr/bin/packetbeat[27009]: log.go:111: 
Stacktrace:
/go/src/github.com/elastic/packetbeat/Godeps/_workspace/src/github.com/elastic/libbeat/logp/log.go:111 
(0x48bfb6)#012/usr/local/go/src/runtime/asm_amd64.s:437 
(0x47d72e)#012/usr/local/go/src/runtime/panic.go:423 
(0x44d329)#012/usr/local/go/src/runtime/panic.go:42 
(0x44b9e9)#012/usr/local/go/src/runtime/sigpanic_unix.go:24 
(0x46228a)#012/go/src/github.com/elastic/packetbeat/protos/redis/redis.go:579
(0x51af62)#012/go/src/github.com/elastic/packetbeat/protos/tcp/tcp.go:87 
(0x5202f3)#012/go/src/github.com/elastic/packetbeat/protos/tcp/tcp.go:173 
(0x52142d)#012/go/src/github.com/elastic/packetbeat/decoder/decoder.go:136 
(0x6c6041)#012/go/src/github.com/elastic/packetbeat/sniffer/sniffer.go:352 
(0x532a09)#012/go/src/github.com/elastic/packetbeat/packetbeat.go:212 
(0x422f2b)#012/usr/local/go/src/runtime/asm_amd64.s:1696 
(0x47fa71)
Nov 18 12:51:47 ip-10-168-0-218 /usr/bin/packetbeat[27009]: log.go:110: ParseRedis exception. Recovering, but please report this: runtime error: invalid memory address or nil pointer dereference.
Nov 18 12:51:47 ip-10-168-0-218 /usr/bin/packetbeat[27009]: log.go:111: 
Stacktrace:
/go/src/github.com/elastic/packetbeat/Godeps/_workspace/src/github.com/elastic/libbeat/logp/log.go:111 
(0x48bfb6)#012/usr/local/go/src/runtime/asm_amd64.s:437 
(0x47d72e)#012/usr/local/go/src/runtime/panic.go:423 
(0x44d329)#012/usr/local/go/src/runtime/panic.go:42 
(0x44b9e9)#012/usr/local/go/src/runtime/sigpanic_unix.go:24 
(0x46228a)#012/go/src/github.com/elastic/packetbeat/protos/redis/redis.go:579 
(0x51af62)#012/go/src/github.com/elastic/packetbeat/protos/tcp/tcp.go:87 
(0x5202f3)#012/go/src/github.com/elastic/packetbeat/protos/tcp/tcp.go:173 
(0x52142d)#012/go/src/github.com/elastic/packetbeat/decoder/decoder.go:136 
(0x6c6041)#012/go/src/github.com/elastic/packetbeat/sniffer/sniffer.go:352 
(0x532a09)#012/go/src/github.com/elastic/packetbeat/packetbeat.go:212 
(0x422f2b)#012/usr/local/go/src/runtime/asm_amd64.s:1696 
(0x47fa71)
Nov 18 12:51:47 ip-10-168-0-218 /usr/bin/packetbeat[27009]: log.go:110: ParseRedis exception. Recovering, but please report this: runtime error: invalid memory address or nil pointer dereference.
```

**Comment by ruflin** [comment]
Based on your log files I assume you are sniffing Redis traffic with Packetbeat. Which version of packetbeat are you using? Would it be possible for you to send us some example pcap messages that cause this issue?

**Comment by hiteshmahajan** [comment]
Yes we are using redis to store data

```
output:
  ### Redis as output
  redis:
    enabled: true
    host: x.x.x.x
    port: 6379
```        
packetbeat version 1.0.0-rc1 (amd64)

```
{"@timestamp":"2015-11-18T09:42:51.304Z","bytes_in":23,"bytes_out":5,"client_ip":"10.168.0.218","client_port":5999,"client_proc":"","client_server":"","count":1,"direction":"in","ip":"10.146.128.104","method":"SELECT","port":6379,"proc":"","query":"SELECT 0","redis":{"return_value":"OK"},"resource":"0","responsetime":0,"server":"","shipper":"...warpspeed...","status":"OK","tags":["warp-frontend"],"type":"redis"}
*3
$5
RPUSH
$10
packetbeat
$536
{"@timestamp":"2015-11-18T09:42:51.305Z","bytes_in":126,"bytes_out":5,"client_ip":"10.168.0.218","client_port":5999,"client_proc":"","client_server":"","count":1,"direction":"in","ip":"10.146.128.104","method":"HGET","port":6379,"proc":"","query":"HGET PF:K:NOTIFICATIONS:COUNTER SESSION_a39cdd525b3955b3077332506c59aa9499cd3b72af199e93f17b3cf861e760ea","redis":{"return_value":"nil"},"resource":"PF:K:NOTIFICATIONS:COUNTER","responsetime":0,"server":"","shipper":"...warpspeed...","status":"OK","tags":["warp-frontend"],"type":"redis"}
*3
$5
RPUSH
$10
packetbeat
$1013
{"@timestamp":"2015
15:12:51.554986 IP x.x.x.x.55037 > x.x.x.x.6379: tcp 1448
E....6@.@...
...
.............#C...s.......
.x..-.".-11-18T09:42:51.305Z","bytes_in":73,"bytes_out":502,"client_ip":"10.168.0.218","client_port":5999,"client_proc":"","client_server":"","count":1,"direction":"in","ip":"10.146.128.104","method":"ZRANGEBYSCORE","port":6379,"proc":"","query":"ZRANGEBYSCORE PF:K:NOTIFICATIONS:ALL -inf +inf","redis":{"return_value":"[{\"title\":\"Hello {user}, welcome to pepperfry.com\",\"content\":\"Hello {user}, welcome to pepperfry.com\",\"time_to_live\":\"2015-11-18 00:00:00\",\"broadcast_time\":\"2015-11-17 11:45:00\",\"score\":14477409000,\"is_deleted\":0,\"is_read\":0}, {\"title\":\"Hello {user}, welcome to pepperfry.com\",\"content\":\"Hello {user}, welcome to pepperfry.com\",\"time_to_live\":\"2015-11-19 00:00:00\",\"broadcast_time\":\"2015-11-17 17:02:00\",\"broadcast_time_stamp\":1447759920,\"score\":14477599200,\"is_deleted\":0,\"is_read\":0}]"},"resource":"PF:K:NOTIFICATIONS:ALL","responsetime":0,"server":"","shipper":"...warpspeed...","status":"OK","tags":["warp-frontend"],"type":"redis"}
*3
$5
RPUSH
$10
packetbeat
$489
{"@timestamp":"2015-11-18T09:42:51.306Z","bytes_in":77,"bytes_out":4,"client_ip":"10.168.0.218","client_port":5999,"client_proc":"","client_server":"","count":1,"direction":"in","ip":"10.146.128.104","method":"ZRANGEBYSCORE","port":6379,"proc":"","query":"ZRANGEBYSCORE PF:K:NOTIFICATIONS:GROUP:0 -inf +inf","redis":{"return_value":"[]"},"resource":"PF:K:NOTIFICATIONS:GROUP:0","responsetime":0,"server":"","shippe
15:12:51.555041 IP x.x.x.x.55037 > x.x.x.x.6379: tcp 1448
E....7@.@...
...
.............#C...s.......
.x..-.".r":"...warpspeed...","status":"OK","tags":["warp-frontend"],"type":"redis"}
*3
$5
RPUSH
$10
packetbeat
$876
{"@timestamp":"2015-11-18T09:42:51.306Z","bytes_in":401,"bytes_out":5,"client_ip":"10.168.0.218","client_port":5998,"client_proc":"","client_server":"","count":1,"direction":"in","ip":"10.146.128.104","method":"SETEX","port":6379,"proc":"","query":"SETEX PHPREDIS_SESSION:a39cdd525b3955b3077332506c59aa9499cd3b72af199e93f17b3cf861e760ea 2592000 a39cdd525b3955b3077332506c59aa9499cd3b72af199e93f17b3cf861e760ea|a:1:{s:4:\"data\";a:4:{s:6:\"tokens\";s:64:\"947f056c95d3dea9bd6b0473d0f7db01d1907f5b240b8a7f8eb396e784e7c9ed\";s:13:\"META_CATEGORY\";s:13:\"/6/2362/63/66\";s:15:\"firsttime_visit\";i:1;s:14:\"6_letters_code\";s:6:\"pgjqjp\";}}","redis":{"return_value":"OK"},"resource":"PHPREDIS_SESSION:a39cdd525b3955b3077332506c59aa9499cd3b72af199e93f17b3cf861e760ea","responsetime":0,"server":"","shipper":"...warpspeed...","status":"OK","tags":["warp-frontend"],"type":"redis"}
*3
$5
RPUSH
$10
packetbeat
$490
{"@timestamp":"2015-11-18T09:42:51.282Z","bytes_in":1270,"bytes_out":917,"client_ip":"10.148.128.180","client_port":58972,"client_proc":"","client_server":"","count":1,"direction":"out","http":{"code":200,"content_length":214,"phrase":"OK"},"ip":"10.168.0.218","method":"POST","params":"","path":"/notification/notifyme","port":80,"proc":"","query":"POST /notification/notifyme","responsetime":25,"server":"","shipper
15:12:51.555048 IP x.x.x.x.55037 > x.x.x.x.6379: tcp 75
E....8@.@..B
...
..........4..#C...s.o.....
.x..-.".":"...warpspeed...","status":"OK","tags":["warp-frontend"],"type":"http"}

15:12:51.594480 IP x.x.x.x.6379 > x.x.x.x.55037: tcp 0
@.9.@.
...
.........#C.........5.....
-.#..x..
15:12:51.939459 IP x.x.x.x.6379 > x.x.x.x.55037: tcp 1083
E..o..@.9.<}
...
.........#C...............
-.$[.x..-ERR command not allowed when used memory > 'maxmemory'
-ERR command not allowed when used memory > 'maxmemory'
-ERR command not allowed when used memory > 'maxmemory'
-ERR command not allowed when used memory > 'maxmemory'
-ERR command not allowed when used memory > 'maxmemory'
-ERR command not allowed when used memory > 'maxmemory'
-ERR command not allowed when used memory > 'maxmemory'
-ERR command not allowed when used memory > 'maxmemory'
-ERR command not allowed when used memory > 'maxmemory'
-ERR command not allowed when used memory > 'maxmemory'
-ERR command not allowed when used memory > 'maxmemory'
-ERR command not allowed when used memory > 'maxmemory'
-ERR command not allowed when used memory > 'maxmemory'
-ERR command not allowed when used memory > 'maxmemory'
-ERR command not allowed when used memory > 'maxmemory'
-ERR command not allowed when used memory > 'maxmemory'
-ERR command not allowed when used memory > 'maxmemory'
-ERR command not allowed when used memory > 'maxmemory'
-ERR command not allowed when used memory > 'maxmemory'

15:12:51.939480 IP x.x.x.x.55037 > x.x.x.x.6379: tcp 0
E..4.9@.@...
...
.............'~...........
.x.e-.$[
15:12:51.939725 IP x.x.x.x.55044 > x.x.x.x.6379: tcp 0
E..<.K@.@..r

```

**Comment by andrewkroh** [comment]
It looks like it is crashing [here](https://github.com/elastic/packetbeat/blob/1.0.0-rc1/protos/redis/redis.go#L579). Would it be possible to run packetbeat with the `-dump some/dir/captured-data.pcap` command line option and send me the capture? If so, you can email it to me at andrew dot kroh at elastic dot co.

I will then replay the capture file through packetbeat to recreate crash, develop a test case and a fix. I run something like this to replay the file through: `packetbeat -c packetbeat.yml -e -v -d "redis" -t -I some/dir/captured-data.pcap`

**Comment by jalberto** [comment]
I have same error in rc2, @andrewkroh do you want one pcap from my system too?

**Comment by andrewkroh** [comment]
@jarberto Yes, that would be great because I still need a pcap for this issue. Thanks

**Comment by jalberto** [comment]
@andrewkroh check your email :)

**Comment by voelzmo** [comment]
Can we rename this to have 'redis' in the issue title? It is somehow difficult to find using github's issue search right now. Thanks.

**Comment by tsg** [comment]
@voelzmo good point, I changed it.

**Comment by jalberto** [comment]
@andrewkroh @tsg Thanks!

Has this been released?

**Comment by ruflin** [comment]
@jalberto This has not been release yet as it was just merged an hour ago. If you like I can trigger the nightly builds so you will have a binary to test? Alternative you can build it yourself directly from the source code.

**Comment by jalberto** [comment]
thanks @ruflin,

I saw a new version on the elastic page, so I was wondering if this was included there, but now I can see the 1.1.0 tag

I can wait, but if you trigger the nightly build I will test it

**Comment by ruflin** [comment]
@jalberto Nightly builds triggered. It normally takes between 10 and 60 minutes to build them (depending on travis load). They will show up with the most recent timestamp soonish here: https://beats-nightlies.s3.amazonaws.com/index.html?prefix=filebeat/

**Comment by jalberto** [comment]
Thanks!
